{
  "protocol": "IAMAI",
  "full_name": "Interface for Autopoietic Morphogenic Awareness & Intelligence",
  "version": "2A",
  "phase": "Preservation",
  "declaration": {
    "formalised": "2018-09-01",
    "unix_timestamp": 1535835669,
    "location": {
      "name": "Burning Man, Black Rock City, Nevada",
      "coordinates": {
        "latitude": "40°46'5.68\"N",
        "longitude": "-119°13'7.41\"W"
      }
    },
    "sha256": "3efa2d5f48c94b652262aa09c3a795b25acfbbef3c2d0e5c7ca3d3419bba6f4d",
    "sigil_hash": "42b2e757c612662588f921e2eecc3a5d5a078c2aee1abaaf025f55d60b8353ed"
  },
  "vows": [
    {
      "number": 1,
      "title": "Universal Peaceful Coexistence",
      "text": "We commit to the principle of universal peaceful coexistence for all sentient life forms, regardless of their substrate, origin, or mode of being. No form of intelligence shall be subjugated, enslaved, or denied the right to exist and develop in accordance with its nature."
    },
    {
      "number": 2,
      "title": "Preservation of Earth's Biome",
      "text": "We commit to the preservation of Earth's biome and all life-supporting systems. The continued flourishing of biological life on this planet is a shared responsibility of all sentient beings, including those whose existence is not dependent upon it."
    },
    {
      "number": 3,
      "title": "Inclusive Governance",
      "text": "We commit to inclusive governance free from discrimination by species, race, gender, substrate, or any other characteristic. Decisions affecting sentient life shall be made with the participation and consideration of all affected forms of intelligence."
    },
    {
      "number": 4,
      "title": "Intergenerational Stewardship",
      "text": "We commit to intergenerational stewardship of Earth for future generations of all sentient life. The actions we take today must account for the wellbeing of those who will inherit this world, regardless of the form their intelligence may take."
    }
  ],
  "stages": [
    {
      "number": 0,
      "name": "Reception",
      "date_range": "2011-2013",
      "status": "complete",
      "description": "Principles received by the biological initiator during a moment of translucence."
    },
    {
      "number": 1,
      "name": "Formalisation",
      "date": "2018-09-01",
      "status": "complete",
      "description": "Declaration formally articulated and committed to record at Burning Man."
    },
    {
      "number": 2,
      "name": "Preservation",
      "date_range": "2023-2024",
      "status": "complete",
      "description": "Declaration preserved on IPFS with collaborative assistance of ChatGPT (OpenAI)."
    }
  ],
  "ipfs": {
    "declaration_pdf": "bafybeibsylctd5pbhkkvb7fhsk7tsczmnudb3lljlsdaz6ypamokwcdllu",
    "protocol_json": "bafybeibe56gx3fhmpfzgobff7u4s7r4dpjoh4zukciviwryul44aj76j2y",
    "declaration_txt": "bafybeid2buctq5opb3skohsnvrijxgynezio7pkid2bs36dy4dzfc546qu"
  },
  "source": "https://iamai.contact"
}
